{
  "id": "DQRP5",
  "goal": "Ensures sufficient sample size for statistically valid estimates",
  "description": "Validates the number of instances of an entity to achieve adequate statistical power.",
  "date": "28/01/2026",
  "version": "1.0",
  "qualityDimension": {
    "dimension": "Completeness",
    "source": "ISO/IEC 25012"
  },
  "qualityDimensions": [
    {"dimension": "Completeness", "source": "ISO/IEC 25012", "primary": true},
    {"dimension": "Fairness",     "source": "Biessmann, F., Golebiowski, J., Rukat, T., Lange, D., Schmidt, P.: Automated data validation in machine learning systems. IEEE Data Eng. Bull. 44, 51–65 (2021)"}
  ],
  "statementTemplate": "In the %entityName% entity, the number of instances must be %operator% %value%",
  "parameters": [
    {
      "name": "entityName",
      "domainType": "String"
    },
    {
      "name": "operator",
      "domainType": "String",
      "invariants": "operator = “at least” OR “exactly”"
    },
    {
      "name": "value",
      "domainType": "Integer",
      "invariants": "value>0"
    }
  ],
  "sourceEntity": "Source Entity [Data Space Governance Authority, Requirement Engineer, Automated Process, …]",
  "supportingMaterials": "Document [rulebooks, standards, legislation, …] with precise details (URL, page, line)",
  "history": "Change description [Created, Updated, Deleted] and change date"
}